С1410;Дикси Лобня Аэропортовская;МО, г. Любня, ул. Аэропортовская, д.5 А;56.019535;37.423033
С1176;Дикси Ломоносовский пр-т;г.Москва, Ломоносовский пр-т, д.29 корп.3;55.704473;37.514922
С1007;Дикси Лухмановская;г.Москва, ул.Лухмановская, д.2;55.711858;37.898574
С1408;Дикси Луховицы Гагарина;МО, г. Луховицы, ул. Гагарина, д.16;54.982125;39.03992
С1298;Дикси Лучинское;МО, Истринский р-н, с/пос. Лучинское, дер. Крючково, ул. Вишневая, уч.11;55.879748;36.799845
С576;Дикси Лыткарино;Лыткарино Квартал 3А, д.24;55.585759;37.90992
С735;Дикси Лыткарино мкр.№5;г.Лыткарино, мкр.№5 квартал 1 д.5;55.585917;37.895745
С590;Дикси Люберецкий р-н п.Красково;Люберецкий р-н, п.Красково, ул.Карла Маркса д.109;55.659896;37.989969
С1070;Дикси Люберцы 8 марта;МО, г.Люберцы, ул.8 марта, д.61;55.704991;37.891927
С577;Дикси Люберцы Воинов;г.Люберцы,ул.Воинов Интернационалистов, д.3;55.696301;37.901997
С667;Дикси Люберцы Комсомольская;МО, г.Люберцы, ул.Комсомольская, д.22;55.676666;37.877778
С579;Дикси Люберцы Коренево;Люберецкий р-н, п.Коренево,ул.Лорха, д.8;55.675534;38.004108
С1264;Дикси Люберцы Красногорская;МО, г.Люберцы, ул.Красногорская, д.1А;55.691653;37.880572
С578;Дикси Люберцы Малаховка;Люберецкий р-н, п.Малаховка, ул.Шоссейная,д.6;55.643668;38.008007
С1299;Дикси Люберцы мкр 7-8;МО, г.Люберцы, мкр. 7-8, квартал 8А корп.12;55.678098;37.877194
С1106;Дикси Люберцы п.Октябрьский;МО, Люберецкий р-н, пос.Октябрьский, ул.Текстильщиков, д.7А;55.606853;37.969829
С1291;Дикси Люберцы Победы;МО, г.Люберцы, ул.Победы, д.14;55.68601;37.886321
С1182;Дикси Люберцы Электрофикации;МО, г.Люберцы, ст.Панки, ул.Электрофикации, д.20В;55.667858;37.922119
С1186;Дикси Люблинская;г.Москва, ул.Люблинская, д.54/3;55.677088;37.738072
С525;Дикси М.Купавенский;Малый Купавенский пр-д д.5 стр.3;55.781165;37.83801
С1211;Дикси Малаховка Касимовское;МО, Люберецкий р-н, п.Малаховка, Касимовское ш., д,4;55.663618;38.016272
С571;Дикси Малые Вяземы;д.Малые Вяземы Городок №17;55.629928;37.029652
С653;Дикси Мамыри;Ленинский р-н, д.Мамыри, д.8;55.561314;37.063357
С1015;Дикси Марии Поливановой !!!!;г.Москва, ул. Марии Поливановой, д.2/19;55.680245;37.448923
С1073;Дикси Маршала Голованова;г.Москва, ул.Маршала Голованова, д.5;55.649622;37.729961
С1014;Дикси Матвеевская;г.Москва, ул.Матвеевская, д.20 кор.3;55.702581;37.466655
С1104;Дикси Медвежьи озера;МО, Щелковский р-н, пос.Медвежьи озера, ул.Садовая, д.1;55.870173;37.987508
С726;Дикси Менделеева;МО, п.Менделеево, ул.Институтская 19;56.032102;37.236893
С1268;Дикси Менжинского;г.Москва, ул. Менжинского, д.23;55.869849;37.660314
С1077;Дикси Митинская;г.Москва, ул.Митинская, д.50;55.851783;37.355489
С1413;Дикси Михайлова;МО, г. Москва, ул. Михайлова, д.22 корп.1;55.726309;37.769145
С620;Дикси Михалевича;г.Раменское, ул.Михалевича, д.5;55.568217;38.231194
С1341;Дикси Михнево;МО, Ступинский р-н, пос.Михнево, ул. Библиотечная, д.14 А;55.120264;37.948763
С619;Дикси Можайск;г.Можайск, ул.1-я Железнодорожная,д.43;55.496154;36.031579
С1216;Дикси Можайск Вокзальная;МО г.Можайск ул.Вокзальная ( рядом с ж/д вокзалом);55.49443;36.028156
С658;Дикси Можайск Павлова;г.Можайск, ул.Академика Павлова, д.13а;55.50265;36.030204
С1083;Дикси Можайск Полевая;МО, г.Можайск, ул.Полевая, д.29;55.499606;36.044146
С1183;Дикси Можайск Полосухина;МО, г.Можайск, ул.Полосухина, д.24А;55.508758;36.028372
С1275;Дикси Можайский р-н Строитель;МО, Можайский р-н, п.Строитель (ТЦ Айсберг);55.497148;36.061681
С1309;Дикси Можайский Ямская;МО, Можайский р-н, дер. Ямская;55.485591;36.021787
С549;Дикси Можайское;г.Одинцово, Можайское шоссе, д.121;55.68192;37.290424
С1249;Дикси Можайское;г.Москва, Можайское шоссе, д.13;55.720302;37.434262
С730;Дикси Можайское ш. 76;МО, г.Одинцово, Можайское ш.76А;55.682767;37.294924
С824;Дикси Молодцова;г.Москва, ул.Молодцова, д.21;55.878384;37.630607
С1130;Дикси Молостовых;г.Москва, ул.Молостовых, д.19, корп.1;55.750814;37.832997
С716;Дикси Монино;МО, п.Монино, ул.Авиационная, д.6а;55.838799;38.200426
С742;Дикси Монино Комсомольская;"п.Монино, ул.Комсомольская, д.4 ""Огонек""";55.844405;38.192593
С744;Дикси Монино Новинское;МО, Щелковский р-н, п.Монино, Новинское ш. д.2А;55.843864;38.200723
С1020;Дикси Москва Волгоградский;г.Москва Волгоградский пр-т. д.3/5 корп.2;55.731886;37.672298
С1205;Дикси Мосренген;г.Москва, поселение Мосренген, д.22;55.620957;37.474516
С1081;Дикси Мстихино;Калужская обл., мкр.Мстихино, Центральная, д.24;54.496317;36.243932
С632;Дикси Мытищи;г.Мытищи, ул.Комарова, д.4;55.918393;37.745241
С1204;Дикси Мытищи Веры Волошиной;МО, г.Мытищи, ул. Веры Волошиной, д.9/24;55.892587;37.724445
С1105;Дикси Мытищи Новомытищинский;МО, г.Мытищи, пр-т Новомытищинский, д.80А;55.90303;37.722837
С746;Дикси Мытищи Олимпийский пр.;МО, г.Мытищи, Олимпийский пр-т, д.34;55.924295;37.757817
С1042;Дикси Мытищи Силикатная;МО, г.Мытищи, ул.Силикатная, д.39;55.940215;37.778604
С648;Дикси Мытищи Юбилейная;г.Мытищи ул.Юбилейная д.19;55.910341;37.714303
С1068;Дикси Мытная !!!!!!!!;г.Москва, ул.Мытная, д.52;55.717087;37.618785
С1237;Дикси Мышкин (Яр);Ярославская обл., г.Мышкин, ул.Газовиков, д.2А;57.787872;38.454578
С821;Дикси Мячковский;г.Москва, Мячковский б-р, д.13;55.654599;37.757
С1302;Дикси Нагатинский пр-д;г.Москва, 1-й Нагатинский проезд, д.11 корп.2;55.677539;37.634398
С817;Дикси Наметкина;г.Москва, ул.Наметкина, д.9;55.663664;37.551861
С721;Дикси Народного Ополчения;г.Москва, ул.Народного Ополчения, д.21;55.77753;37.477282
С1074;Дикси Народного Ополчения 29;г.Москва, ул.Народного Ополчения, д.29;55.781565;37.479789
С639;Дикси Наро-Фоминск;МО г.Наро-Фоминск ул. Московская д.11б;55.382677;36.75183
С642;Дикси Наро-Фоминск М.Жукова;МО г.Наро-Фоминск, пл.Свободы, ТЦ Заречье;55.385602;36.73496
С1006;Дикси Наро-Фоминск Рижская;г.Наро-Фоминск, ул.Рижская, д.7;55.379777;36.732759
С621;Дикси Нахабино;г.Нахабино, ул.Волоколамская, д.1Б;55.817633;37.339166
С1318;Дикси Нахабино Красноармейская;МО, Красногорский р-н, п. Нахабино, ул. Красноармейская, д.22;55.847427;37.179069
С1297;Дикси Нежинская;г.Москва, ул. Нежинская, д.13;55.706431;37.470976
С1187;Дикси Немчиновка;МО, Одинцовский р-н, с.Немчиновка, Советский пр-т, д.106;55.727552;37.352929
С528;Дикси Нижегородская;ул.Нижегородская д.9Г, стр.1;55.738404;37.681928
С1273;Дикси Нижегородская 72;г.Москва ул.Нижегородская д.72/2;55.73291;37.710952
С844;Дикси Новаторов;г.Москва, ул.Новаторов, д.16;55.667691;37.524902
С1373;Дикси Нововязники Шоссейная;Владимирская обл., п. Нововязники, ул. 1-ая Шоссейная, д.1;56.199792;42.164737
С1121;Дикси Новогиреевская;г.Москва, ул.Новогиреевская, д.10 кор.1;55.76251;37.791855
С1012;Дикси Новокосинская;г.Москва, ул.Новокосинская, д.22;55.740005;37.861097
С1354;Дикси Новомичуринск Пронская (Ряз);Рязанская обл., г.Новомичуринск, мкр.Д, ул. Пронская, д.11;54.038741;39.737965
С855;Дикси Новомосковск (Тл);г.Новомосковск, ул.Г.Белова, д.3;54.028783;38.31603
С1096;Дикси Новомосковск Московская (Тл) 0,5;Тульская обл.. г.Новомосковск, ул.Московская\Коммунистическая, д.6\6;54.007893;38.297184
С1097;Дикси Новомосковск Трудовые резервы (Тл) 0,5;Тульская обл., г.Новомосковск, ул.Трудовые резервы, д.71;54.031507;38.280278
С671;Дикси Ново-Петровское;МО, Истринский р-н, п.Ново-Петровское, ул.Кооперативная, д.8;55.995171;36.47373
С1406;Дикси Новопетровское Советская;МО, Истринский р-н,с. Новопетровское, ул. Советская, д.21;55.993066;36.477296
С599;Дикси Новорогожская;г.Москва, ул.Новорогожская, д.11,корп.2;55.742402;37.682107
С732;Дикси Ногинск 3-го Интернационала д.39;г.Ногинск, ул.3-го Интернационала, д.39;55.85726;38.451209
С662;Дикси Ногинск 9;МО, г.Ногинск 9  ТЦ1,2;55.897352;38.447005
С1378;Дикси Ногинск Климова;МО, г. Ногинск, ул. Климова, д.42;55.864768;38.454488
С1303;Дикси Ногинск Советской Конституции 40;МО, г.Ногинск, ул. Советской Конституции, д.40;55.890199;38.449826
С1377;Дикси Ногинск Советской Конституции д.30;МО, г. Ногинск, ул. Советской Конституции, д.30;55.886186;38.451299
С505;Дикси Ногинск Текстилей;МО,г.Ногинск, ул.Текстилей, д.9;55.883121;38.449484
С751;Дикси Обнинск Аксенова;г.Обнинск, ул.Аксенова, д.17;55.117932;36.613498
С1362;Дикси Обнинск Аксенова 6;Калужская обл., г. Обнинск, ул. Аксенова, д. 6А;55.116119;36.614001
С1244;Дикси Обнинск Белкинская;г.Обнинск ул.Белкинская д.2;55.122457;36.60412
С750;Дикси Обнинск Гагарина;г.Обнинск, ул.Гагарина, д.35;55.118992;36.585794
С1363;Дикси Обнинск Долгинская;Калужская обл., г. Обнинск, ул. Долгинская, д. 4;55.108091;36.582767
С1225;Дикси Обнинск Карла Маркса;Калужская обл., г.Обнинск, пр-т Карла Маркса, д.56;55.117787;36.600365
С813;Дикси Обнинск Ленина;г.Обнинск, ул.Ленина 104;55.105387;36.59688
С542;Дикси Оболенский;пгт.Оболенский ул.Биологов д.1;55.985121;92.699939
С508;Дикси Обухово;МО,г.Ногинск,пос.Обухово,ул.Ленина, д.38.А;55.83339;38.265734
С748;Дикси Одинцово;МО, г.Одинцово, ул.Маковского, д.2а;55.670732;37.280956
С1270;Дикси Одинцово Маковского 16;МО, г.Одинцово, ул. Маковского, д.16;55.664822;37.28277
С1414;Дикси Одинцово Садовая;МО, г. Одинцово, ул. Садовая, мкр. 2 к.16;55.676143;37.250305
С1393;Дикси Одинцово Советская;г. Одинцово, ул. Советская, д. 5 А;55.672752;37.277865
С1223;Дикси Озеры;МО, г.Озеры, микрорайон-1, д.7Б;54.852687;38.522921
С534;Дикси Октябрьский;г.Подольск,Октябрьский проспект,д.21;55.43249;37.506415
С593;Дикси Орехово Зуево Бирюкова;г.Орехово Зуево, ул.Бирюкова,д.37А;55.812266;38.965791
С1230;Дикси Осташево;МО, Волоколамский р-н, с.п. Осташевское, с.Осташево, Рузское шоссе, д.3;55.856634;35.868256
С1011;Дикси Островитянова;г.Москва, ул.Островитянова, д.18;55.63626;37.511284
С1271;Дикси Островитянова 11;г.Москва ул.Островитянова д.11 кор.1;55.641813;37.5008
С1403;Дикси п. Горетово;Можайский р-н, п. Горетово;55.610062;35.801601
С1371;Дикси п. Мечниково;МО., Красногорский р-н, п. Мечниково, ул. Мечниково, д.27;55.749831;37.162252
С1286;Дикси п. Шишкин Лес;г.Москва, п. Михайлово-Ярцевское, пос. Шишкин Лес, д.36;55.412232;37.184414
С1308;Дикси Павлино;МО, г. Железнодорожный, мкр. Павлино, 34Б;55.726847;37.966101
С1319;Дикси Павлово-Слободское Сиреневый Бульвар;МО, Истринский р-н, Павлово-Свободское с.п., с. Рождествено, ул. Сиреневый Бульвар, (ЖК Новые Снегири);55.864707;37.047106
С697;Дикси Павловская Слобода;Истринский р-н, Павловская Слобода, ул.Луночарского, д.13;55.815418;37.088734
С1191;Дикси Павловское;МО, Истринский р-н, с.п. Ивановское, д.Павловское;55.87;36.951067
С517;Дикси Парковская 28;МО, г.Орехово-Зуево, ул.Парковская,д.28;55.822594;39.004454
С518;Дикси Парковская 5;МО, г.Орехово-Зуево, ул.Парковская, д.5а;55.818791;38.992857
С711;Дикси пгт.Шилово;Рязанская обл., пгт.Шилово, ул.Индустриальная, д.25 а;54.319333;40.863518
С1133;Дикси Первомайская;г.Москва, ул.Первомайская, д.100;55.792382;37.811007
С1188;Дикси Первомайское;г.Москва, Троицкий АО, с.п. Первомайское, п.Птичное, ул.Лесная;55.526633;37.217157
С1316;Дикси Первомайское Рабочая;г. Москва, п. Первомайское, ул. Рабочая, д.9 (ТЦ Первомайский);55.540689;37.15556
С812;Дикси Пересвет;Сергиево-Посадский р-н, г.Пересвет, ул. Строителей, д.1;56.415385;38.173989
С767;Дикси Переславль Залесский Строителей (Яр);76411 ЯО г.Переславль-Залесский, ул.Строителей, д.41;56.750389;38.880936
С785;Дикси Переславль-Залесский 50лет Комсомола (Яр);ЯО, г.Переславль-Залесский, ул.50 лет Комсомола, д.19;56.754144;38.87436
С1045;Дикси Переславль-Залесский Кривоколенный (Яр);Ярославская обл., г.Переславль-Залесский, пер.Кривоколенный, д.5;56.739692;38.859206
С1044;Дикси Переславль-Залесский Московская (Яр);Ярославская обл., г.Переславль-Залесский, ул.Московская, д.56;56.715603;38.820084
С1170;Дикси Петушки;Владимирская обл., г.Петушки, ул.Московская, д.14;55.933327;39.454915
С1262;Дикси Пироговский;МО, поселок Пироговский, ул.Тимирязева, д.8 пом.1;55.980825;37.73809
С828;Дикси Плавск (Тл);Тульская обл., г.Плавск, ул.Коммунаров, д.52;53.70792;37.29373
С1166;Дикси Плавск Октябрьская (Тл);Тульская обл., г.Плавск, ул.Октябрьская, д.36;53.70421;37.282393
С899;Дикси Плеханова;г.Москва, ул.Плеханова, д.20;55.743061;37.766217
С897;Дикси Поварово;МО, Солнечногорский р-н, пос.Поварово, ул.Почтовая, д.29 кор.1;56.079226;37.058254
С1147;Дикси Подолино;МО, Солнечногорский р-н, сельское поселение Кутузовское, д.Подолино, ТЦ к.7;55.93;37.265478
С1001;Дикси Подольск 65-летия Победы;г.Подольск, б-р 65-летия Победы, д.8, к.1;55.419074;37.484379
С1057;Дикси Подольск 65-летия Победы 5;МО, г.Подольск, б-р 65-летия Победы, д.5 кор.2;55.418466;37.481118
С1027;Дикси Подольск Академика Доллежаля;МО, г.Подольск, ул.Академика Доллежаля, д.7 к.1;55.42;37.486903
С1384;Дикси Подольск Мраморная;МО., г. Подольск, ул. Мраморная, д.2 пом.1;55.439242;37.566593
С743;Дикси Подольск Октябрьский 19;г.Подольск, Октябрьский пр-т д.19;55.431856;37.506235
С1380;Дикси Подольск Орджоникидзе;МО., г. Подольск, Орджоникидзе, д.19;55.418103;37.574157
С1317;Дикси Подольск Правды;МО, г. Подольск, ул. Правды, д.3;55.411292;37.565147
С837;Дикси Подольск Профсоюзная;МО. г.Подольск ул.Профсоюзная д.13;55.464442;37.547432
С1189;Дикси Подольск Профсоюзная 4А;МО, г.Подольск, ул.Профсоюзная, д.4а;55.464565;37.552049
С561;Дикси Подольск Рабочая;г.Подольск, ул.Рабочая, д.42;55.437919;37.566297
С1190;Дикси Подольск Садовая;МО, г.Подольск, ул.Садовая, д.3 к.2;55.451058;37.548007
С734;Дикси Подольск Свердлова;г.Подольск, ул. Свердлова, д.5;55.427555;37.542859
С1381;Дикси Подольск Свердлова 30;МО., г. Подольск, ул. Свердлова, д.30, кор.1;55.423346;37.53729
С1382;Дикси Подольск Свердлова 48;МО., г. Подольск, ул. Свердлова, д.48;55.41747;37.531622
С1383;Дикси Подольск Циолковского;МО., г. Подольск, ул. Циолковского, д.10/6;55.399213;37.556729
С533;Дикси Подольск Юбилейная;г.Подольск,ул.Юбилейная,д.32А, пом.1;55.431152;37.49798
С1064;Дикси Подольских Курсантов;г.Москва, ул.Подольских Курсантов, д.2 корп.1;55.60815;37.610431
С1086;Дикси Покров;Владимирская обл., г.Покров, ул.Ленина, д.87;55.917415;39.175556
С1358;Дикси Попутная;г.Москва. ул. Попутная д.6;55.654442;37.38675
С1213;Дикси Пошехонье (Яр);ЯО, г.Пошехонье, ул.Советская, д.15;58.500961;39.12384
С1215;Дикси Пречистое (Яр);ЯО, Пречистое, ул.Ярославская, д.39А;58.428194;40.317603
С1016;Дикси Производственная;г.Москва, ул.Производственная, д.2;55.650455;37.388008
С892;Дикси Проспект Мира;г.Москва, Проспект Мира, д.95, стр.2;55.808199;37.635143
С538;Дикси Протвино;г.Протвино ул.Ленина д.16;54.86828;37.217427
С1148;Дикси Протвино Фестивальный;МО, г.Протвино, ул. Фестивальный пр-д, д.2а, пом.1,2;54.877304;37.228413
С1049;Дикси Профсоюзная;г.Москва, ул.Профсоюзная, д.104;55.64192;37.523456
С1355;Дикси Путятино (Ряз);Рязанская обл., Путятинский р-н, с. Путятино, ул. Дзержинского, д.1;54.154634;41.115441
С513;Дикси Пушкино;МО,г.Пушкино,Московский проспект, д.5;56.011157;37.844666
С1037;Дикси Пушкино 3-я Домбровская;г.Пушкино, ул.3-я Домбровская, д.27;56.00626;37.829871
С834;Дикси Пушкино Горького;г.Пушкино, ул.Горького, д.2-2а;56.007499;37.843157
С669;Дикси Пушкино Московский;МО, г.Пушкино, Пушкинский район , Московский пр-т д.53;56.001902;37.861267
С1272;Дикси Пушкино Московский 59;МО, г.Пушкино Московский пр-т д.59;55.996747;37.862282
С1056;Дикси Пушкино Центральная;МО, г.Пушкино, ул.Центральная, д.17А;55.986924;37.851655
С1036;Дикси Пушкино Чехова;г.Пушкино, ул.Чехова, д.40/7;56.003865;37.844918
С594;Дикси Пущино;"МО, г.Пущино, МКРН ""Д""";54.830244;37.635512
С737;Дикси Пущино мкр.В;г.Пущино мкр-н В д.10А;54.832795;37.620663
С664;Дикси Радужный;МО, г.Московский, ул.Радужная, д.19 кор.1;55.589213;37.374884
С794;Дикси Радужный 1квартал д.67 (Яр);г.Радужный, 1-й квартал д.67;55.999279;40.332182
С614;Дикси Радумля;пгт.Радумля, мкр.Мехзавода №1 д.11А;56.075383;37.125691
С677;Дикси Развилка;МО, Ленинский район, п.Развилка, д.46;55.591177;37.761222
С1245;Дикси Раменки;г.Москва, ул. Раменки, д.16;55.690085;37.489877
С1321;Дикси Раменский р-н Родники;МО, Раменский р-н, пгт. Родники, ул. Большая Учительская, д.14;55.648646;38.05136
С1034;Дикси Раменское Бронницкая;г.Раменское, ул.Бронницкая, д.6;55.562749;38.235973
С1019;Дикси Раменское Дергаевская;г.Раменское, ул.Дергаевская, д.32;55.580172;38.242908
С894;Дикси Раменское Космонавтов;г.Раменское, ул.Космонавтов, д.1;55.58554;38.202295
С692;Дикси Раменское Космонавтов 40;г.Раменское, ул. Космонавтов, д.40;55.591543;38.204559
С585;Дикси Раменское Красноармейская;г.Раменское, ул.Красноармейская, д.15А;55.572248;38.237104
С584;Дикси Раменское Михалевича;г.Раменское,ул.Михалевича,Промышленный корпус №43;55.562999;38.244138
С1260;Дикси Растуново;"МО, Домодедовский р-н, с.Растуново, вл. ""Портал"" стр.7";55.27319;37.842519
С638;Дикси Реутов Некрасова;г. Реутов ул.Некрасова д.12;55.77075;37.847846
С1409;Дикси Реутов пр-т Мира;МО, г. Реутов, пр-т Мира, д.57 Б;55.771378;37.864609
С691;Дикси Ржавки;МО, Солнечногорский р-он, п.Ржавки,  д.2;56.01318;37.221227
С1227;Дикси Ржев Зубцовское ш (Тв);Тверская обл., г.Ржев, Зубцовское шоссе, д.7;56.247041;34.333754
