к1906;Агапов 1 - Куусинена 2;Москва, м.Полежаевская, ул. Кусинена, д.2;55.778254;37.517626
к669;Алекста-Основная;Домодедово,ул. Рабочая 57/1;55.423402;37.767537
к670;Алекста-т10;Домодедово, ул. Гагарина д.50;55.450241;37.74278
к664;Алекста-Точка 1;Домодедово,мкр Белые столбы,ул Кирова,д 1;55.33384;37.846993
к665;Алекста-Точка 2;г.Домодедово,агрогород Заря;55.272939;37.8335
к667;Алекста-Точка 3;Домодедово,Санаторий «Подмосковье»;55.377163;37.763656
к668;Алекста-Точка 4;Домодедово,мкр Авиационный, ул Чкалова д2;55.416346;37.838127
к663;Алекста-Точка 5;Домодедово, Ул Каширское шоссе д 97 точка 5;55.424715;37.774113
к1079;Алекста-Точка 6;Домодедово,мкр Авиационный, ул Туполева д9;55.414261;37.834498
Р1;Алтаев;г.Волоколамск;56.030884;35.956569
Р1;Алтаев;г.Волоколамск;56.028601;35.949527
Р1;Алтаев;г.Волоколамск;56.028224;35.950703
Р1;Алтаев;г.Волоколамск;56.023948;35.958501
Р1;Алтаев;г.Волоколамск;56.025241;35.958582
Р1;Алтаев;г.Волоколамск;56.030387;35.956569
Р1;Алтаев;г.Волоколамск;56.030547;35.960333
Р1;Алтаев;г.Волоколамск;56.018972;35.939259
к92;Алхазов/Енисейская 16/21;ул.Енисейская 16/21;55.864414;37.662704
27П;Аносов Балашиха Дзержинского напротив д.38*;г.Балашиха мкр.Дзержинского напротив д.38;55.776705;37.900407
401М;Аносов ст. Кучино;МОг. Железнодорожный  ст. Кучино;55.7521;37.955258
396М;Аносов(16) Керамика-1;МО, г. Железнодорожный,Керамика-1у проходной керамкомбината ул Керамическая дом 1;55.744835;37.971616
398М;Аносов(18) Кучино-1*;МО, г. Железнодорожный,Кучино-1у подземного перехода ж/д ст. Кучино (ул Центральная);55.7521;37.955258
399М;Аносов(19) Кучино-2*;МО, г. Железнодорожный,Кучино-2 ул Центральная дом 35;55.750383;37.954503
400М;Аносов(20) Салтыковка*;МО, г. Железнодорожный,Салтыковкау входа на платформу ст Салтыковская в сторону области;55.757642;37.923278
30П;Аносов. г.Балашиха -2 ул.Заречная 18А;г.Балашиха -2 ул.Заречная 18А;55.824253;37.967511
408м;Аносов/ Главная;МО, г. Железнодорожный,ул Главная;55.746172;37.991802
402М;Аносов/ Заря3;МО, г Балашиха Заря3;55.753595;38.085496
411М;Аносов/ Заря4;МО, гБалашихаЗаря4;55.758797;38.079405
381М;Аносов/ Юбилейная (1);"МО, г. Железнодорожный, Юбилейная (1), д.10 кафе ""Сказка""";55.740294;38.018877
390М;Аносов/(10) Советская;МО,г. Железнодорожный, Советская дом 18;55.750261;38.018302
391М;Аносов/(11) Заря-1*;МО,Заря-1рынок митрич павильон 3а (у ж/д станции Заря);55.75364;38.085846
392М;Аносов/(12) Заря-2*;МО, г. Железнодорожный, Заря 2;55.753595;38.085496
393М;Аносов/(13) Маяковская;МО, Маяковская Маяковская у дома4;55.758093;37.925973
394М;Аносов/(14) Октябрьская;МО, г. ЖелезнодорожныйОктябрьская у дома 15;55.749486;38.003075
395М;Аносов/(15) Павлино*;МО, г. Железнодорожный,Павлино рядом с рынком дом 15;55.728748;37.969308
397М;Аносов/(17) Керамика-2;МО, г. Железнодорожный,Керамика-2 ул Керамическая дом 32;55.749628;37.973494
382М;Аносов/(2) Трансагенство;МО, г. Железнодорожный, Трансагенство Саввинское шоссе, д.2;55.74563;38.010181
383М;Аносов/(3) Альбатрос;МО, г. Железнодорожный,, Альбатрос  Саввинское шоссе, д.10;55.744151;38.014852
384М;Аносов/(4) Пионерская;МО, г. Железнодорожный, Пионерская , д.14 Универсам на Пионерской;55.741723;38.025354
385М;Аносов/(5) Мелодия;МО, г. Железнодорожный,Мелодия пересечение ул.Пионерской и ул Колхо;55.74336;38.024617
386М;Аносов/(6) Колхозная;МО, г. Железнодорожный, Колхозная дом 7;55.745995;38.022928
387М;Аносов/(7) Маркет;МО, г. Железнодорожный,ул. Новая, д. 34;55.748209;38.026692
388М;Аносов/(8) Новая;МО, г. Железнодорожный, Новая ул Новая дом 39 у аптеки;55.748924;38.024895
389М;Аносов/(9) Орион;МО, г. Железнодорожный,ул. Школьная д. 20.;55.746532;38.017053
410М;Аносов/Вокзал;МО, г. Железнодорожный,ул Привокзальная пл.;55.751533;38.008241
409М;Аносов/Некрасова;МО, г. Железнодорожный,ул Некрасова;55.748584;37.99871
500М;Аносов/Павлино-2*;МО, г. Железнодорожный,микрорайон Павлино д18;55.727171;37.967852
412М;Аносов/Рынок;МО, г. Железнодорожный,;55.74674;38.008941
501М;Аносов/Саввино ул. 1Мая д.9;МО,г.Железнодорожный микр. Саввино ул. 1Мая д.9;55.729199;38.024752
502М;Аносов/ул. Граничная д 18*;МО, г. Железнодорожный,ул граничная д18;55.746796;37.985765
к315;Аносов/ул.Речная;МО, г. Железнодорожный,ул Речная;55.743654;37.958833
к813;Антипов Е.В(Мария)-01 Печать Апрелевка;г.Троицк м/н В Апрелевка;55.5492;37.06889
к814;Антипов Е.В(Мария)-02 Печать Кокошкино;Кокошкино;55.59986;37.172798
к816;Антипов Е.В(Мария)-04 Печать Калининец;"г. Калининец у магазина ""Дикси""";55.556131;36.971971
к817;Антипов Е.В(Мария)-05 Печать Марушкино;Марушкино;55.595145;37.212244
к818;Антипов Е.В(Мария)-06 Печать Марушкино, Аллея;Марушкино, Аллея;55.595699;37.208066
к165;Арутюнян;МО, г.Домодедово перед Ж/Д вокзалом;55.436402;37.766567
к690;Беланов-Кулькова;МО г.Озеры 2-ой мкрн д9;54.853553;38.566993
к1711;Борисова О.А. Коровинское ш.,16;м.Петровско-Разумовское, Коровинское ш.,16;55.874541;37.529025
к1712;Борисова О.А.-Коровинское шоссе, д.2;Москва, Коровинское шоссе, д.2;55.867511;37.541431
к1948;Буланенкова-Алтуфьево;г.Москва,алтуфьевское шоссе 16;55.857321;37.585673
к250;Валяев В.Б. - Озеры;МО, г. Озеры, мкр 1, около дома №20   8-916-448-22-08 Ольга;54.857289;38.521403
к604;Васильева-СущевскийВал13;Москва, м.Савеловская, ул.Сущевский вал, 13;55.792989;37.595276
к593;Винницкая Г.Д. - Дмитров ж/д вокзал;МО, г.Дмитров, ж/д и автовокзал;56.337491;37.510808
к1034;ВИС-Автопресс - 3-я Парковая, 26/2;Москва, ул. 3-я Парковая, д. 22;55.794275;37.783213
к1036;ВИС-Автопресс - 3-я парковая, напротив д.6;Москва, ул. 3-я парковая, напротив д.6;55.789633;37.784641
к1045;ВИС-Автопресс - 9-я парковая 66/2;Москва, ул. 9-я парковая 66/2;55.807107;37.800299
к1035;ВИС-Автопресс - Измайловский б-р, 47;Москва, ул. Измайловский б-р, 47;55.797235;37.799769
к1037;ВИС-Автопресс - Измайловский пр-т, 61;"Москва, ул. Измайловский пр-т, 61, Киоск ""Пресса"", рядом с Мороженым и Шаурмой";55.78891;37.78368
к1038;ВИС-Автопресс - Маршала Тухачевского, 55;Москва, ул. Маршала Тухачевского, 55, Рядом с остановкой;55.783635;37.458337
к1007;ВИС-Автопресс - Пятницкое шоссе, 36;Пятницкое шоссе, 36;55.854082;37.362136
к1040;ВИС-Автопресс - Свободы, 30;Москва, ул. Свободы, 30, На углу, рядом с билетной кассой;55.841377;37.455732
к1041;ВИС-Автопресс - Сущевский вал, 5;Москва, ул. Сущевский вал, 5;55.794806;37.592455
к1042;ВИС-Автопресс - Уральская, вл.17;Москва, ул. Уральская, вл.17;55.820207;37.79737
к1043;ВИС-Автопресс - Хабаровская, 8;Москва, ул. Хабаровская, 8, На остановке;55.818882;37.827706
к1044;ВИС-Автопресс - Химкинский б-р, 21;Москва, ул. Химкинский б-р, 21, Рядом с остановкой;55.849448;37.443173
м114;Гавричев- Бескудниковский;Москва,  бескудниковский б-р д23;55.867662;37.555238
м113;Гавричев- Мурановская;Москва,  ул Мурановская д15;55.894232;37.601178
м112;Гавричев- Снежная;Москва,  ул.Снежная д18;55.851945;37.647549
928ц;Горделадзе ж/д платформа Солнечная;Солнцево ж/д платформа Солнечная;55.657164;37.385025
к1832;Демьяненко ж/д пл. Переделкино;г.Москва ж/д платформа Переделкино;55.65627;37.355156
р230;Добров В.Н 01 г.Дмитров, Больница;МО, г.Дмитров, ул.Мининина ост. Больница;56.346766;37.533122
к326;Евдокимова О.С.  - Ореховый б-р;Москва, м.Домодедовская, Ореховый б-р,15;55.612726;37.719899
к338;Евдокимова О.С. - Андропова;Москва, пр-т Андропова, 21 около сбербанка синий киоск;55.679138;37.665444
к1463;Евдокимова О.С. - Каширская 1;Москва, м. Каширская, южный выход, напротив ресторана;55.655432;37.649256
к1462;Евдокимова О.С. - Каширская 2;Москва, м. Каширская, северный выход из метро напротив фермерского рынка, рядом с павилионом Цветы;55.655432;37.649256
к1465;Евдокимова О.С. - Каширское шоссе, 4;Москва, Каширское шоссе, 4;55.668447;37.627795
к1464;Евдокимова О.С. - Коломенская;Москва, м. Коломенская, Пр-т Андропова, д.25;55.677621;37.664887
к339;Евдокимова О.С. - Новинки;Москва, Новинки, д.3;55.677905;37.667644
к550;Зеленко/Точка №10;Москва, ул. Теплый Стан, д.1;55.619996;37.502211
к559;Зеленко/Точка №19;Москва, ул. Профсоюзная, д.21;55.675514;37.561275
К543;Зеленко/точка №3;"Москва, м. Нахимовский пр-т, д.9А, рядом маг. ""Магнолия""";55.663568;37.608077
к546;Зеленко/Точка №6;Москва, Новоясеневский пр-т, вл. 2;55.617759;37.505714
к547;Зеленко/Точка №7;"Москва, ул. Профсоюзная, д.58/32  ТК ""Черемушки"" круглый киоск ""Печать Информ""";55.669356;37.552328
к73;Зотова;Сигнальный проезд д 35 корп 2;55.851525;37.602678
е858;Иволга/Сокольники;Москва Сокольническая пл-дь д.9 корп2;55.789866;37.680643
е857;Иволга/Сухаревкая;Москва ст. м. Сухаревская п/п;55.772315;37.632332
к2138;Истра-Пресс ООО - Адасько, 2;МО, г.Истра, Адасько, 2;55.909731;36.860751
к2131;Истра-Пресс ООО - Баня;МО, г.Истра, ул. Советская, 31-33;55.919448;36.865099
к2134;Истра-Пресс ООО - Босова;МО, г.Истра, ул. Босова, 23;55.911951;36.866087
к2137;Истра-Пресс ООО - Воскресенская пл-дь, 3;МО, г.Истра, Воскресенская пл-дь, 3;55.915397;36.857696
к2133;Истра-Пресс ООО - Н.Иерусалим;МО, г.Истра, ул. Панфилова, автостанция;55.914539;36.840143
к2132;Истра-Пресс ООО - Площадь;МО, г.Истра, Полощадь Революции, д.3;55.913712;36.860355
к2135;Истра-Пресс ООО - Северный;МО, г.Истра, пос. Северный, д.6, РайПО;55.944788;36.837619
к2136;Истра-Пресс ООО - ул. 9-й Гвардейской дивизии, 33;МО, г.Истра, ул. 9-й Гвардейской дивизии, 33;55.913384;36.867551
к164;Калитаев А.Ю. - Бирюлево-2;Москва, Сумской проезд, 2.ТЦ;55.637403;37.614599
к161;Калитаев А.Ю. - Введенского, 29;Москва, ул. Введенского, д.29  перед входом в магазин Пятерочка;55.633572;37.534478
к168;Калитаев А.Ю. - Островитянова;Москва, Островитянова, д.9;55.643769;37.496075
к474;"Калмыков - 01 МЦ ""Комета""";МО, г.Егорьевск, 2й мкрн, вл.15;55.369495;39.062809
к475;"Калмыков - 02 ТЦ ""Пятерочка"" (ул.Октябрьская)";МО, г.Егорьевск, ул.Октябрьская, вл.16;55.384186;39.030245
к476;"Калмыков - 03 ТЦ ""Дикси"" (5мкрн)";МО, г.Егорьевск, 5й мкрн, вл.1;55.380237;39.050772
к477;"Калмыков - 04 ТЦ ""Лесной""";МО, г.Егорьевск, ул.Антипова, 2;55.370421;39.068307
к478;Калмыков - 05 Смычка;МО, г.Егорьевск ул.Смычка;55.36905;39.020265
к479;Калмыков - 06 Автовокзал;г.Егорьевск;55.371219;39.057626
к483;Калмыков - 07 Рынок;МО, г.Егорьевск, Центральный городской рынок;55.369096;39.067795
к24;Касторная-Фрунзенская;Москва, м.Фрунзенская, Комсомольский проспект,д.28. справа от метро;55.726877;37.579645
к392;Клименко Н.Н. - Герцено;МО, пос. Герцено;55.608628;36.600518
к381;Клименко Н.Н. - Голицыно;МО, г. Голицыно, Звенигородское шоссе;55.615187;36.989228
к378;Клименко Н.Н. - Голицыно 2;МО, г.Голицыно Петровское шоссе, у д. № 3;55.615187;36.989228
к380;Клименко Н.Н. - Голицыно 3;МО, г. Голицыно ул. Советсткая  у д.52\5;55.621968;36.983497
к379;Клименко Н.Н. - Городок 17;МО, п. Малые Вяземы, Городок 17 около рынка ( улицы нет);55.640294;37.014884
к386;Клименко Н.Н. - Колюбакино;МО, п. Колюбакино, ул. Попова д.16;55.670762;36.523838
к382;Клименко Н.Н. - Летний отдых;МО, п. Летний отдых ул. Зеленая, д.1 киоск стоит на площади;55.641427;36.973049
к387;Клименко Н.Н. - Савинка;МО, С.Савинская Слобода ул. Садовая у д. № 5В;55.721458;36.791473
к385;Клименко Н.Н. - Старый городок;"МО, п. Старый городок ,ул. Школьная д. 13 (около рынка ""Ярославна"")";55.599021;36.689568
к384;Клименко Н.Н. - Старый городок 2;МО, п. Старый Городок ул. Заводская , между д. 7 и д. 8 ( на автобусной остановке);55.597856;36.694994
к383;Клименко Н.Н. - Часцы;МО, Одинцовский район п. Часцы ,участок 11-В, 53+500 км Можайского шоссе справа (около автоб. остановки);55.617139;36.862386
к734;Климов - Рязанский пр-т;Москва Рязанский проспект д 75;55.718141;37.79198
к2057;Климов- Каширское ш;Москва, Каширское шоссе, 28, киоск Московский комсомолец;55.653507;37.649418
к80;Климова;Привокзальная площадь,пос.Поворово Солнечногорского р-на;56.073162;37.062054
к1251;Климов-Пражская;Москва, м.Пражская на пересечении ул.Красного маяка киоск МК;55.611577;37.603972
Р20;Колчина - Горького;МО. г.Кашира-1, ул.Горького, Владение 1;54.836736;38.151711
Р19;Колчина - К-1;МО. г.Кашира-1, ул Советская между д.20 и д.26;54.836145;38.150507
к390;Коренков И.Б. - Советская;МО, Голицино, Советская, д.62;55.619513;36.984655
к376;Коренков М.Б. - Вокзал;МО, Одинцовский р-н, г. Кубинка, привокзальная площадь;55.57836;36.691912
к1421;Коренков М.Б. - ж/д платформа Голицыно;МО, ж/д платформа Голицыно;55.615243;36.986865
к1422;Коренков М.Б. - ж/д платформа Жаворонки;МО, ж/д платформа Жаворонки;55.641844;37.097475
к372;Коренков М.Б. - Кубинка;МО, г. Кубинка, Нарофоминское шоссе, д.5;55.576772;36.693808
к345;Коренков М.Б. - Лесной городок;МО, Одинцовский р-н, пос. Лесной городок, ул.Фасадная, д.12;55.636128;37.211839
к374;Коренков М.Б. - Стройка;МО, г.Кубинка, р-н Кубинка 10, рынок;55.57889;36.690816
к375;Коренков М.Б. - Школьный поселок;МО, Одинцовский р-н., пос. Большие Вяземы, д.2;55.627468;36.983991
237М;Кравец. Н.Ю. - Грузинский вал , вл. 26/14;Москва, Грузинский вал , вл. 26/14;55.698797;37.739168
р48;Красов р48 - Гостиница;г. Краснознаменск, МО  (р48);55.59806;37.035446
р49;Красов р49 - Госпиталь;г. Краснознаменск, МО (р49);55.597856;37.039462
р51;Красов р51 - Бульвар;г. Краснознаменск, МО (р51);55.59806;37.035446
р52;Красов р52 - Двор;г. Краснознаменск, МО  (р52);55.59806;37.035446
и124;Крюков А.А. - м. Автозаводская, п/п, секция 13;Москва, м. Автозаводская, п/п, секция 13, последний вагон из центра;55.706634;37.657008
и130;Крюков А.А. - м. Алтуфьево, север. п/п 03, секция 16;Москва, м. Алтуфьево, север. п/п 03, секция 16;55.898376;37.587344
и204;Крюков А.А. - м. Улица 1905 года,  полуличный переход, секция 9;Москва, м. Улица 1905 года,  подуличный переход, секция 9;55.764273;37.561419
к625;Кузовлев /5-Э;"МО, г. Электросталь, рынок ""Южный""  (к625)";55.768907;38.449538
к1920;ЛазаревГА-КарлаМаркса, ост.Больница;пос.Красково, ул.Карла Маркса, ост.Больница;55.659724;37.991272
к1922;ЛазаревГА-Народный магазин;пос.Красково, магазин Народный;55.658886;37.98846
к1919;ЛазаревГА-Пионерская, 19;пос.Томилино, ул.Пионерская, д.19;55.668564;37.950048
к1921;ЛазаревГА-Школьная, 2;пос.Красково, ул.Школьная, д.2;55.659724;37.9836
к160;Лапшинов;Лосино-Петровский  рынок палатка №10,ул ленина 11;55.87091;38.20075
к223;Литвинов А.А. - Павелецкая;Москва, ул. Новокузнецкая д 39;55.732357;37.635485
Р44;Лунина - Воинская часть;Городской округ Домодедово, село Ям, воинская часть 56135;55.481046;37.753326
Р43;Лунина - Магазин;Городской округ Домодедово, село Ям, ул.Центральная 21;55.486081;37.751502
к523;Лунина Наталья - Алтуфьево;м. Алтуфьево, южный п/п, секция 1;55.898376;37.587344
к524;Лунина Наталья - Калужская;м. Калужская, северный п/п, секция 17;55.656682;37.540075
к522;Лунина Наталья - Крылатское;м.Крылатское,восточный подуличный переход,секция 12;55.756842;37.408139
к1029;Лунина Наталья - м. Сходненская север, секция №8;Москва, м. Сходненская север, секция №8;55.85051;37.439787
к1106;Лунина Наталья - м. Щукинская, южный п/п, секция 06;Москва, м. Щукинская, южный п/п, секция 06;55.808827;37.463772
к1725;Лунина Наталья - м.Южная, южный п/п, секция № 17;Москва, м.Южная, южный п/п, секция № 17;55.622436;37.609047
к526;Лунина Наталья - Подбельского;м. Ул Подбельского, южный подуличный переход,секция 9;55.814264;37.735117
к520;Лунина Наталья - Сходненская;м.Сходненская, южный подуличный переход, секция 22;55.85051;37.439787
к521;Лунина Наталья - Южная;м.Южная, северный подуличный переход, секция 16;55.622436;37.609047
к1070;Лунина Наталья - Южная 2;м.Южная, северный подуличный переход, секция 17;55.622436;37.609047
к127;Любезнова М.И. - м. Братиславская сев. выход киоск в переходе;Москва, м.Братиславская киоск в переходе;55.65946;37.750514
к128;Любезнова М.И. - м.Братиславская южн. выход киоск в переходе;Москва, м.Братиславская юж. выход;55.65946;37.750514
к123;Любезнова М.И. - Ул.Перерва киоск;"Москва, м.Братиславская  Т.Ц.""БУМ""";55.65946;37.750514
М40;Лялина - Домодедовская;Москва, ул.Домодедовская, д 28 ТЦ Белград;55.604742;37.712318
к828;Лях Л.В. - Коломенская;Москва, Коломенская, д.5;55.683483;37.704502
к1466;Лях Л.В. - Криворожская, 33;Москва, Криворожская, 33;55.671768;37.609272
к120;м.Римская;Москва, м. Римская;55.746228;37.681254
к1659;Мазлова - Троицк;г. Троицк, Сиреневый б-р, д.8;55.471791;37.29664
к4115;Максимов/Теплый Стан, вл.1а;Москва, Теплый Стан, вл.1а (рядом киоск хлеб);55.61873;37.505912
к323;Мамедов Д.Д.;г.Москва ул. Капотня д. 24/1;55.630507;37.798637
к2114;Манукян/Апрелевка;МО,  платформа Апрелевка;55.550157;37.066896
к2116;Манукян/Нара в Москву;МО,  Нара в Москву;55.383352;36.751309
к2115;Манукян/Нара из Москвы;МО, Нара из Москвы;55.383352;36.751309
к293;Маслов -г.Зеленоград;г.Зеленоград,Солнечная аллея,9-й микрорайон,корп 900;55.981374;37.184387
м181;МиКам-В - 01 м.Скобелевская - сев.вых.;г.Москва, метро «Ул.Скобелевская», северный вход;55.548034;37.554618
м182;МиКам-В - 02 м.Скобелевская - южн.вых.;г.Москва, метро «Ул.Скобелевская», южный вход;55.548034;37.554618
м183;МиКам-В - 03 м. Бульвар Адмирала Ушакова;г.Москва, метро «Бульвар Адмирала Ушакова»;55.545207;37.542329
